{
  "revision": "0.2",
  "in_scope_questions": [
    "Q1",
    "Q2",
    "Q4",
    "Q7",
    "Q8"
  ],
  "authorities": {
    "decision": "D01",
    "roles": {
      "sponsor": "leynos",
      "technical-owner": "leynos"
    }
  },
  "decisions": [
    {
      "id": "D01",
      "subject": "Decision authority for architecture, scope, release readiness, exceptions, and proof-API changes",
      "questions": [
        "Q1",
        "Q8"
      ],
      "authority_roles": [
        "sponsor"
      ],
      "options": [
        {
          "id": "A",
          "summary": "The sponsor alone accepts every decision."
        },
        {
          "id": "B",
          "summary": "The sponsor plus a named technical owner, who may be the same person, with delegated acceptance of contract records and pre-registrations."
        }
      ],
      "recommendation": "B",
      "rationale": "Terms of reference §9 already names \"Sponsor and technical owner\" as the authority for Q2 and Q4; choosing the sponsor alone would require amending that column.",
      "lifecycle": "accepted",
      "decided_option": "B",
      "accepted_by": "leynos",
      "accepted_on": "2026-10-10",
      "approval_reference": {
        "kind": "session",
        "url": "https://lody.ai/leynos/sessions/99861d46-f6f5-48d6-acfb-658bee9364bf",
        "author_login": "leynos",
        "names_decisions": [
          "D01"
        ],
        "answer": "Sponsor and technical owner @leynos"
      },
      "adr": "docs/adrs/adr-0002-governance-authority.md",
      "supersedes": [],
      "superseded_by": null,
      "retired_statements": [
        {
          "document": "docs/terms-of-reference.md",
          "text": "Requested the work; final technical and release authority still needs explicit designation."
        },
        {
          "document": "docs/terms-of-reference.md",
          "text": "Sponsor to designate."
        },
        {
          "document": "docs/terms-of-reference.md",
          "text": "It does not itself approve a release, set budgets, or resolve the questions above."
        }
      ]
    },
    {
      "id": "D02",
      "subject": "Trusted-boundary exception policy",
      "questions": [
        "Q8"
      ],
      "authority_roles": [
        "sponsor"
      ],
      "options": [
        {
          "id": "A",
          "summary": "An exception is valid from its approval date until its `invalid_from` date, at most 90 days and never past the next release-gate task (4.3.3 or 6.3.4); renewal is a new approval; an exception names a narrowed claim and can never satisfy a proof-required component."
        }
      ],
      "recommendation": "A",
      "rationale": "Bounded lifetimes force each exception to be revisited, and a narrowed claim keeps an exception from being read as proof (technical design §17.2, GAP9).",
      "lifecycle": "accepted",
      "decided_option": "A",
      "accepted_by": "leynos",
      "accepted_on": "2026-10-10",
      "approval_reference": {
        "kind": "session",
        "url": "https://lody.ai/leynos/sessions/99861d46-f6f5-48d6-acfb-658bee9364bf",
        "author_login": "leynos",
        "names_decisions": [
          "D02"
        ],
        "answer": "Accepted"
      },
      "adr": "docs/adrs/adr-0002-governance-authority.md",
      "supersedes": [],
      "superseded_by": null,
      "retired_statements": [
        {
          "document": "docs/technical-design.md",
          "text": "Proof-exception and specification-compatibility authority unassigned."
        }
      ]
    },
    {
      "id": "D03",
      "subject": "Initial release scope",
      "questions": [
        "Q4"
      ],
      "authority_roles": [
        "sponsor",
        "technical-owner"
      ],
      "options": [
        {
          "id": "A",
          "summary": "Accept the Core, Integration, and Deferred split in technical design §2 unchanged."
        },
        {
          "id": "B",
          "summary": "Amend the scope matrix in technical design §2 before acceptance."
        }
      ],
      "recommendation": "A",
      "rationale": "The split already maps every requirement to a roadmap phase and keeps integration work out of the Core acceptance dossier.",
      "lifecycle": "accepted",
      "decided_option": "A",
      "accepted_by": "leynos",
      "accepted_on": "2026-10-10",
      "approval_reference": {
        "kind": "session",
        "url": "https://lody.ai/leynos/sessions/99861d46-f6f5-48d6-acfb-658bee9364bf",
        "author_login": "leynos",
        "names_decisions": [
          "D03"
        ],
        "answer": "Accepted"
      },
      "adr": "docs/adrs/adr-0003-initial-release-scope.md",
      "supersedes": [],
      "superseded_by": null,
      "retired_statements": [
        {
          "document": "docs/technical-design.md",
          "text": "The classes remain proposed pending ToR Q4."
        },
        {
          "document": "docs/language-reference.md",
          "text": "The **Core** scope is the proposed initial numeric-language release."
        },
        {
          "document": "docs/context.md",
          "text": "Unresolved choices include a dependency/toolchain baseline, quantitative performance and compile-cost gates, the accepted core release boundary, and actual trasic adoption access."
        },
        {
          "document": "docs/roadmap.md",
          "text": "All work remains proposed and open."
        },
        {
          "document": "docs/roadmap.md",
          "text": "The foundational phase resolves candidate ADRs identified in `technical-design.md` §15; no accepted ADR or ExecPlan exists in this evidence set."
        }
      ]
    },
    {
      "id": "D04",
      "subject": "Package licence",
      "questions": [
        "Q7"
      ],
      "authority_roles": [
        "sponsor"
      ],
      "options": [
        {
          "id": "A",
          "summary": "Ratify the ISC licence already recorded in `Cargo.toml`, `LICENSE`, and `README.md`."
        }
      ],
      "recommendation": "A",
      "rationale": "ISC is permissive and is already in place through ADR-0001; ratification removes the open question without changing any file.",
      "lifecycle": "accepted",
      "decided_option": "A",
      "accepted_by": "leynos",
      "accepted_on": "2026-10-10",
      "approval_reference": {
        "kind": "session",
        "url": "https://lody.ai/leynos/sessions/99861d46-f6f5-48d6-acfb-658bee9364bf",
        "author_login": "leynos",
        "names_decisions": [
          "D04"
        ],
        "answer": "Accepted"
      },
      "adr": "docs/adrs/adr-0004-licence-and-publication.md",
      "supersedes": [],
      "superseded_by": null,
      "retired_statements": []
    },
    {
      "id": "D05",
      "subject": "External publication policy",
      "questions": [
        "Q7"
      ],
      "authority_roles": [
        "sponsor"
      ],
      "options": [
        {
          "id": "A",
          "summary": "Set `publish = false` in `Cargo.toml` until the Core acceptance dossier (task 4.3.3) passes and the D01 authority approves release."
        }
      ],
      "recommendation": "A",
      "rationale": "Publication before the Core dossier would promise distribution terms for an unproven library.",
      "lifecycle": "accepted",
      "decided_option": "A",
      "accepted_by": "leynos",
      "accepted_on": "2026-10-10",
      "approval_reference": {
        "kind": "session",
        "url": "https://lody.ai/leynos/sessions/99861d46-f6f5-48d6-acfb-658bee9364bf",
        "author_login": "leynos",
        "names_decisions": [
          "D05"
        ],
        "answer": "Accepted. Ensure this is clearly documented in the developer's guide."
      },
      "adr": "docs/adrs/adr-0004-licence-and-publication.md",
      "supersedes": [],
      "superseded_by": null,
      "retired_statements": [
        {
          "document": "docs/technical-design.md",
          "text": "Q1/Q4/Q7; docs stay proposed and unreleased."
        },
        {
          "document": "docs/technical-design.md",
          "text": "Initial release boundary, licence, and authorities unratified."
        }
      ]
    },
    {
      "id": "D06",
      "subject": "Pre-1.0 API and public proof-interface compatibility policy",
      "questions": [],
      "authority_roles": [
        "sponsor",
        "technical-owner"
      ],
      "options": [
        {
          "id": "A",
          "summary": "Ratify ToR C5 and technical design §15 row 10 (no shims for pre-1.0 or unreleased APIs); follow Cargo's 0.y.z rule (a change to the leftmost non-zero component is breaking); version the public proof interface (models, pre- and postconditions, lemmas, trust declarations) with the crate version, treating a strengthened precondition or weakened postcondition as breaking (technical design §17.8). MSRV stays with ToR Q3 and task 1.2.1."
        }
      ],
      "recommendation": "A",
      "rationale": "It applies the existing no-compatibility-machinery constraint to both the Rust API and the proof interface that downstream proofs depend on.",
      "lifecycle": "accepted",
      "decided_option": "A",
      "accepted_by": "leynos",
      "accepted_on": "2026-10-10",
      "approval_reference": {
        "kind": "session",
        "url": "https://lody.ai/leynos/sessions/99861d46-f6f5-48d6-acfb-658bee9364bf",
        "author_login": "leynos",
        "names_decisions": [
          "D06"
        ],
        "answer": "Accepted"
      },
      "adr": "docs/adrs/adr-0005-pre-1-0-api-and-proof-interface-policy.md",
      "supersedes": [],
      "superseded_by": null,
      "retired_statements": [
        {
          "document": "docs/context.md",
          "text": "No blanket source-API compatibility machinery is proposed for this unreleased, pre-1.0 library."
        }
      ]
    },
    {
      "id": "D07",
      "subject": "Dispositions of the candidate ADR subjects",
      "questions": [],